UMAP_1,UMAP_2,Dominant_Logic,Passage,Point_ID,Point_ID_Display,Display_Preview
0.41858378,0.10157541,CERTAINTY,I don't sell what we don't have,bbb36151-ac2d-43f7-8f06-c92aae22b166,111,I don't sell what we don't have
0.40240678,0.10141328,CERTAINTY,"even if you figure out what companies are the right ones to invest in, you still have to look at pain points",bc2ee83b-1308-4de1-8580-036b7cf5e2bf,112,even if you figure out what companies are the right ones to ...
0.37385106,0.08428195,FINANCIAL PERFORMANCE FIRST,no one wants to put any investment into something that doesn’t achieve a return in 12-24 months,bd284a3e-d018-4d7b-8abc-1e1568b41e2c,113,no one wants to put any investment into something that doesn...
0.4317449,0.0659338,CERTAINTY,...that's the risk / uncertainty... We don't dare to step outside normal ways of doing things,bd463bdd-9bb8-4c43-b818-434ed7d41637,114,...that's the risk / uncertainty... We don't dare to step ou...
0.41623116,0.08019646,FIRST-HAND KNOWLEDGE,nobody tells GCs not to spend money...i.e. Avensor,c19194a2-c09d-4bd3-96d8-84339d576f6b,115,nobody tells GCs not to spend money...i.e. Avensor
0.41621226,0.10276033,RULES,if we made ourselves more productive we may be able to take those solutions to the market,c40539db-1d5e-4347-b869-f981abf33203,116,if we made ourselves more productive we may be able to take ...
0.40641066,0.09830691,CERTAINTY,I'm not sure our markets are ready for 'I'm going to turn over my wastewater treatment plant to you and you optimize my cost for that…',c55fc7bb-7065-478e-96c6-9ec224896e0f,117,I'm not sure our markets are ready for 'I'm going to turn ov...
0.42074734,0.10820192,CERTAINTY,what are we missing in the unaddressd 5B? (we don't really know our markets),c8d342ab-df72-4709-b2da-eb57ec03a541,118,what are we missing in the unaddressd 5B? (we don't really k...
0.43539703,0.11615896,CERTAINTY,"you have to have a good spread across the whole lot (horizon 1, 2 and 3)",cb843bfb-dda9-451e-8319-01fa1846d0b4,119,you have to have a good spread across the whole lot (horizon...
0.42067397,0.10135306,FIRST-HAND KNOWLEDGE,everyone is always special...,cd0434c0-88e8-4f3c-86af-77ae451bfd57,120,everyone is always special...
0.41384292,0.117142834,ENTREPRENEUR,we can move the customer away from 'break-fix' because they don't have to be involved (in predictive solution),d034eaef-c20d-4b74-b7b3-354fed044530,121,we can move the customer away from 'break-fix' because they ...
0.41622537,0.10204697,CERTAINTY/FIRST-HAND KNOWLEDGE,Goulds was innovative: we were always talking to the maintenance people because they know what is really going on,d03b8bf5-f6f1-4455-88a7-7315145c157c,122,Goulds was innovative: we were always talking to the mainten...
0.42563105,0.05231001,ENTREPRENEUR,(operating within XPD) would not be beneficial for what we do,d0c1649e-68a5-4d0c-b7dc-24c9cc6635a9,123,(operating within XPD) would not be beneficial for what we d...
0.39220276,0.05023386,FINANCIAL PERFORMANCE FIRST/CERTAINTY,utilities are not seeking major innovation...if NPD makes only 50% of the business case...,d4acfca5-88f3-4b7d-ad76-13d9603e26e8,124,utilities are not seeking major innovation...if NPD makes on...
0.37498295,0.08018361,CERTAINTY,we need to have a digital enteroprise mentality from the top down,d5893fcb-c41e-4540-b27d-430db0acd96b,125,we need to have a digital enteroprise mentality from the top...
0.4342188,0.07346433,ENTREPRENEUR,I would have given them the authority,d5ddedaf-f0a0-401c-8dd0-54e2d4885348,126,I would have given them the authority
0.4022789,0.11069761,FINANCIAL PERFORMANCE FIRST/ CERTAINTY,marketingteams inside sales teams should be able to work with my team…and they don't have capacity either…you just have to invest! You need capacity to go take a look…,d726b7df-8819-4f14-a3dd-467374d2bca3,127,marketingteams inside sales teams should be able to work wit...
0.43647143,0.12376877,CERTAINTY,we need to pick the spot where we think (the need) is going to be real (real solutions),d7c8128e-45b5-48e8-be37-d0feeae44d52,128,we need to pick the spot where we think (the need) is going ...
0.40422857,0.0990854,CERTAINTY,I know that the key to innovation is observing true customer pain points,d9b8451b-69b0-4211-8ff4-a6a755403ebe,129,I know that the key to innovation is observing true customer...
0.41516703,0.06358607,CERTAINTY/FINANCIAL PERFORMANCE FIRST,we find ways to break processes inside XYL but most people are not willing to do that (story of buying single component on credit card),dad65c94-6aaa-494a-9a1d-946e05e1b2b0,130,we find ways to break processes inside XYL but most people a...
0.42569813,0.11465459,RULES,without an org structure in place to (mitigate) against different priorities,dd90722a-2b31-4877-92cd-445f5ac519e4,131,without an org structure in place to (mitigate) against diff...
0.42030674,0.11204773,FINANCIAL PERFORMANCE FIRST,"product roadmaps challenges by available spend, customer adaptability and use",ded03ee9-4aa3-4229-9965-2260e7860e20,132,"product roadmaps challenges by available spend, customer ada..."
0.42179793,0.11620512,CERTAINTY,what is the problem are we really solving? The roadmap should be what problems are we trying to solve for customers that they really value,df9051eb-80bf-406d-914f-5f581713e9b2,133,what is the problem are we really solving? The roadmap shoul...
0.4155083,0.100597605,UNK,we know climate change and energy efficiency are real needs,e1519a3a-fbea-4ffc-946b-1ffedd013be6,134,we know climate change and energy efficiency are real needs
0.3901953,0.10749598,ENTREPRENEUR,so who gets the profit out of that?,e1843f5e-dd2f-47e8-9fcb-e5e9cbdf9851,135,so who gets the profit out of that?
0.36764386,0.08329211,FINANCIAL PERFORMANCE FIRST,xylem thinks about hiow not to spend money and how to make money...how we can we get to 50% digital if we don't spend money...we have no chance of meeting that,e20dd037-f70b-43a9-b645-28c4b746067e,136,xylem thinks about hiow not to spend money and how to make m...
0.4054809,0.056999363,ENTREPRENEUR,breakthrough innovation here is incremental,e362aded-3e1b-40e9-b590-3e00e3dbcee1,137,breakthrough innovation here is incremental
0.430645,0.061191306,ENTREPRENEUR,it is ok to take risk...its required,e37beb04-a705-4e7e-abae-8f1c6b859555,138,it is ok to take risk...its required
0.40716237,0.0834317,CERTAINTY,I would link up with Amazon to get all our equipment on line…that wolud be most helpful for us,e77e8318-b408-484a-95c4-41dec949b88a,139,I would link up with Amazon to get all our equipment on line...
0.4186864,0.07096125,ENTREPRENEUR,my role is to run this little start up,eba06591-598d-4f70-abbd-420ac0eef2b0,140,my role is to run this little start up
0.43425915,0.07347309,EXPERIMENT AND ITERATE,…but we need larger scale pilots,ec267a43-7cac-4cfd-986f-fc6b25e245cf,141,…but we need larger scale pilots
0.36876994,0.08671462,CERTAINTY,"digital is just a tool….lets go out and find pay points…we're trying to push digital out, rather than saying…if we could cut customer costs in half…but we're not doing that",edb465ab-b167-4843-a041-75c8c6605519,142,digital is just a tool….lets go out and find pay points…we'r...
0.4033504,0.05452779,ENTREPRENEUR,we largely focus on doing product development work and where there is a mechanism in place we do innovation stuff,efd2d6a6-8fd2-4ccb-9e7b-5189789c676c,143,we largely focus on doing product development work and where...
0.38886356,0.08589577,CERTAINTY,(beta vs vhs cartridge analogy),f03e32ee-5355-445c-b810-6b11fe749509,144,(beta vs vhs cartridge analogy)
0.39572266,0.10579513,FINANCIAL PERFORMANCE FIRST,people's happiness is equated with productivity and all of a sudden you get to the dollar,f3300092-46e9-472e-9c23-033f6a746ad4,145,people's happiness is equated with productivity and all of a...
0.3678758,0.080368906,FINANCIAL PERFORMANCE FIRST,we should be investing (much more) in digital..we are well below industry standards…we can't do it without investing money...we have to r,f4a29793-0ab8-4d22-ba36-f0f97685b50e,146,we should be investing (much more) in digital..we are well b...
0.40188983,0.05728418,CERTAINTY,"we are not brave enough, we are too risk averse to say 'that needs to change' (stop doing local digital work)...not rocking the boad",f559d5f1-2827-4d55-b213-31cbf443654b,147,"we are not brave enough, we are too risk averse to say 'that..."
0.3714054,0.088288814,ENTREPRENEUR,At xylem we stop at the data or information stage,f5b7940a-4703-4512-b085-0a3816a540cf,148,At xylem we stop at the data or information stage
0.41798022,0.13119794,ENTREPRENEUR,strategy is often equated with plan,f91f3aa2-1cfb-45f7-b51d-f49f74dd9a67,149,strategy is often equated with plan
0.4203028,0.107905835,CERTAINTY/RULES,(because we don't hold people accountable) we need a P&L structure to hold people accountable and set priorities,f968ede2-ee79-45b8-9ed0-7f94d806dd07,150,(because we don't hold people accountable) we need a P&L str...
0.39819974,0.098277934,CERTAINTY,"we need to look at the industrial systems…not in Xylem terms, but in customer problem terms…those things will lead to 'we might be able to solve it this way…'. We don't get into that…enough",fa30da0b-adaa-4cd4-8baa-f6c810cec246,151,we need to look at the industrial systems…not in Xylem terms...
0.43277794,0.072229974,ENTREPRENEUR,"you cannot have the normal procedures intruding on the (agile, entrepreuneial) approach because it removes a lot of the benefits",fb2e3a32-c096-4485-b8fe-be175f013ef3,152,you cannot have the normal procedures intruding on the (agil...
0.40866086,0.06304781,FINANCIAL PERFORMANCE FIRST,"integration with XYL - much harder, bc XYL spend on R&D is 3 and a bit",fe660cf7-266c-4a48-81ae-51e60d9c5876,153,"integration with XYL - much harder, bc XYL spend on R&D is 3..."
0.39673656,0.051643785,ENTREPRENEUR,it's not big picture stuff (we don't do big picture innovation),fee0dfd8-ab1b-4d21-a160-454b400244d1,154,it's not big picture stuff (we don't do big picture innovati...
